number,title,classification,timestamp,latitude,longitude,year,State,report_number,observed
57103,Report 57103: LEO has a daylight sighting at a ranch outside Grapeland,Class A,2017-03-15T12:00:00Z,31.55668,-95.38226,2017,Texas,57103.0,"It was Thanksgiving 2007 in Houston County Texas. Outside of Grapeland Texas, on a private ranch. My brother-in-law asked if I wanted to go with him and my father-in-law to the private ranch that he managed and check the hog traps he had set. They had been overrun with them for a while and he had caught 20 in the past weeks. I said yes, and we were off, it was mid day and still bright and clear. We were in my brother-in-laws truck he was driving, me in the middle, and my father-in-law at the passenger side. When we got to the gate of the property, my FIL got out and opened the gate and we pulled thru and waited for him to close the gate and get in. As soon as he got in, we slowly started to pull forward...Then, from our left out of the pine thicket came this HUGE thing, about 8 1/2 to 9ft tall,and very dark brown almost black hair 3 to 4 inch long. Huge chest and shoulders, long arms and no neck,it ran with incredible speed..in 3 long strides it covered from the trees across the road in front of us and into the right side tree line which is 30 ft.  and then over a fence onto another mans property which is part of ELKHART CREEK and flows to the Trinity River. It made no sound. And we had our windows down.This creature was clearly seen by all 3 of us and we just sat there for awhile to gather our wits...Then I started laughing..I wasn't scared. Just shocked..I said ""What do Yall think that was""? They said, You KNOW WHAT IT WAS...AINT NO BEAR! They both swore they would never mention it to anyone.. they were afraid people would think they are nuts and they would lose their jobs..I am A retired Police officer and didn't care... It has changed my life. My BIL then said ""Well that explains what tore up my big Hog Trap!!"
57712,Report 57712: Motorist has night time visual of an individual carrying a deer near the town of Edom,Class A,2015-10-30T12:00:00Z,32.31565,-95.48672,2015,Texas,57712.0,I was driving home it was about 3 in the morning .Just turned off hwy 64 on to FM 279.  I always drive below speed limit because of deer as I was driving over a bridge  on 279 entering Vanzandt county had my bright lights on to the right saw this big hairy thing carrying a deer it kind of scared me never saw nothing like that I just took off.
57754,Report 57754: Hunter in a pasture has twilight sighting through his rifle scope in Reklaw,Class A,2017-11-15T12:00:00Z,31.86794,-94.95061,2017,Texas,57754.0,"I was hunting in Reklaw in the Angelina river bottom. I was in a pasture with a .243 and a high power scope. It was about 45 minutes till dark and my feeder just went off there were some doe out to the right of the feeder about 100yards. I was watching them then out of the corner of my eyes I seen something walking on 2 feet I pulled my rifle up to look through the scope and seen it was big and brown. It had hair all over it, it was like nothing I have ever seen. It came out of some woods in the neighbors pasture and was walking towards me. It was about 7 feet tall and it looked to be about 500lbs it disappeared into the woods to the left of my neighbors pasture and I didn't see it again I know the people that hunt over there and they are all around 6 foot and no where as big as this was."
57760,Report 57760: Nighttime sighting in a backyard in Round Rock,Class A,2017-06-23T12:00:00Z,30.51559,-97.67403,2017,Texas,57760.0,"I know there will be many who will not believe what I am about to relate as I am still having trouble coming to terms with all of it myself. My plan was to not post anything about what happened last night and pretend it was all just a dream - but the nightmare continues to haunt me even during the day.  I can’t shake the image I had seen or the sounds I had heard.  And the only way for me to make sense of and deal with any of it is to write it down while it’s still fresh in my memory. I’ll just come out and say it.  Last night (Friday, June 23, 2017) I saw a very large and tall “thing” in our backyard, and it would seem to have been the being otherwise known as (dare I say it?) BIG FOOT! I’m sure it sounds crazy, but it’s true.  And I consider myself to be one who quickly debunks extraordinary claims by others concerning UFO activity, Lock Ness Monster shenanigans, and - yes - even BIG FOOT sightings. Our youngest son used to watch those goofy BIG FOOT shows to where my wife and I would offhandedly snicker to one another at his fervent belief in something so obviously fake. Come on!  None of that stuff is real.  It’s made up by kids, people who are in desperate need of professional assistance, or those  seeking attention.  I wish what I experienced wasn’t true, and fell into one of the aforementioned categories as my life would be less complicated. Here’s what happened: It all started off as a regular Friday evening.  Drum students were drumming in the studio, our children were playing video games,   my wife was cleaning, and I was working on writing parts for an upcoming show.  Something I do best while enjoying the company of great music. I remember loudly listening to 2112 and the A side of the album had run it’s course, requiring me to get up and turn the record over in order to listen to the B side.  As I approached the turntable I thought I had seen someone running down by our creek area.  Which is odd because the individual would have to be very tall, much taller than what would be considered a normal sized person, for me to see from where I had been standing.  I stopped the record player and curiously walked over to the french doors located on the West side of our home. Everything appeared quiet and normal.  I didn’t notice anything.  I thought nothing more about it (at the time) and went back to attending to my music writing.  This is when things suddenly became …strange. While listening to the song “Twilight Zone” (by Rush) I heard an unusual howling-type noise which created a dissonant clash with what I was accustomed to hearing during that particular song.  At first I thought something may have been wrong with my speakers, but the bizarre sound continued even when I had turned the music off. It almost sounded like a “hoot,” though much deeper and varied. Our three dogs began nervously congregating by the door, and seemed extremely agitated as each paced back and forth.  They even began doing their own unusual howling, something I had never witnessed any of them to do prior to (or since) yesterday evening. I thought there must have been another dog or possibly one of the wild coyotes recently observed in our neighborhood, hanging out by the creek. In order to ensure the safety of our dogs (I didn’t want any of our pets getting rabies, or eaten!) I grabbed a broom - not the best choice for a weapon - and opened the door to investigate. This is where things happened rapidly.  It’s all pretty much a big blur at this point. As I shut the door our littlest dog (Elphaba) squeezed through the narrow opening and bolted toward the back fence overlooking the creek area. She looked cute running at breakneck speed.  That was until I looked up and noticed this large creature in our creek area glancing in our direction by the swing - with glowing greenish-yellow eyes - as it quickly turned away and ran to the South, following the flow of our creek until it quickly disappeared. I was stunned.  Where I was expecting a little nuisance I had found a magnificently imposing creature.  The likes of which I hadn’t thought possible, much less probable. It was surreal to watch such a large creature move so quickly as it bounded toward highway 79, and retreated underneath the overpass and beyond. I only caught a brief glimpse of the thing.  It was tall, hairy, had large feet, and it was extraordinarily fast for it’s size. All that remained was the memory of those few fleeting seconds, and a swing gently swayed in the wake of the awesome being’s hasty movements. Apparently my wife had heard our dogs making their odd noises  in our home and opened the door only to find me standing along the edge of our fence holding our littlest dog and staring at…nothing. I didn’t know how to respond when she asked me what it was that I was looking at - for I wasn’t sure for myself. The last thing we both heard was that strange sounding and ear-piercing howling-hoot.  We just looked at one other while our dogs responded in kind with their own versions of the odd sound. My wife had asked what made the noise, and I didn’t know what to say. It was a rough night.  I had read the claims by the folks in our Round Rock Parks & Recreation Department, and subsequent sightings.  It all had seemed so silly, even childish. And yet, overnight, my opinion had changed - in a huge way. It’s a big deal for me to share what I experienced in our creek area last night.  I have a feeling there will be unbelievers (heck, I had been one myself).  I’m ok with that as I know what we heard and what I saw.  And Elphaba saw it, too. And the weirdest thing of all was how happy our dogs seemed once they were all outside.  As if they were glad to be around a long lost friend.  They were smelling vigorously, and wagged their tails as they looked toward where the swing was still moving. The best thing is we feel confident we’ll know if we’re ever visited again as our dogs will most likely make those same strange sounds, perhaps as an announcement letting us know of their returning friend. And we will be ready next time, camera in hand. Saturday, June 23, 2017."
62746,Report 62746: Sighting by motorist 10 miles SE of Big Thicket National Preserve,Class A,2019-04-16T12:00:00Z,30.19144,-94.32404,2019,Texas,62746.0,"My son and I were driving at 10mph north on Bragg Rd. to see its famous swamp gas lights, with just my parking-lights on. As we neared the end of the road, within sight of the farm-road, a large, solid-black animal came out of the woods on the east side of the road, walking slowly on two legs. It was between 7-8 feet tall, and solid-black. It looked like it had a healthy-weight, more than a human. Definitely not a black bear! It appeared trim and muscular, with it's long arms hanging down past it's knees. It's upper-profile reminded me of ""Homer Simpson"" (best description I can think of). The thing was about 20ft. from the front of the pick-up, causing me to come to a stop. It knew my truck was there, but it continued it's slow pace, seemingly without care. The scariest part of the encounter was when it paused and looked at us. It's eyes reflected like glowing embers when the parking lights from my truck hit it. The thing continued walking, stepping over the road-grade and continuing into the forest. I stopped my truck and I could still hear it crunching around in the woods out of sight now as it walked away. I am a retired combat veteran and I don't scare easy, but I was. We left immediately. My son only caught the tail end of the sighting but confirmed he saw something. The dirt road was well packed so I couldn't see any footprints left behind. It was very unsettling for me because it looked so human, and because it had the size and presence that it could have harmed us or done serious damage to my truck if it wanted to. I used to enjoy hiking and sleeping alone in the woods at night in my hammock, but not anymore. I know what's out there with me now in the woods!"
62926,Report 62926: Sighting at dawn by motorist NE of Avinger near Black Cypress Creek,Class A,2019-05-30T12:00:00Z,34.03789,-94.32321,2019,Arkansas,62926.0,"I drive the same route every evening to work a night shift at a hospital in Atlanta Tx.  I drive from near Avinger Tx to Atlanta down Hwy 155.   I was running late and got behind a guy towing a boat and he was going well below the speed limit so I took the first opportunity to pass him. He sped up causing me to have to speed up to pass and as soon as I got around him a state trooper came over the hill and I was flying, about 85 mph.  I knew I was in the wrong but the hwy takes a right turn and there is a county road to the left (cr 1579).  I turned there really quickly before the trooper was able to see me and he flew past the turn off and missed me. I did not really know where I was after I turned right on CR 1580 and it dead ends at Black Cypress Creek.  I turned around and started back the way I had come and glanced in the rearview mirror and that is when I saw it cross the road about 75 yards behind me.  I have a dash camera on the front but not on the back.  I tried to swing it around to get it on film but the footage was terrible. I know what I saw.  It was at least 7 ft tall and black as a hog but had to weigh over 400 lbs.  It was a freak encounter but I know what I saw.  I never believed any of this but there is no doubt at all.  It was looking at my jeep as it crossed behind me and then it was just gone.  I have not been back there and I am not sure if I will go back."
63665,Report 63665: Multiple incidents reported by multiple hunters near Sam Rayburn Lake,Class A,2019-11-18T12:00:00Z,31.1659,-94.1679,2019,Texas,63665.0,"I have multiple reports to make. Bigfoot is living in the Angelina National Forest, no doubts. My husband grew up hunting there, but I have only been hunting in there for the past 4-5 years. Geography, it is on Sam Rayburn lake, piney woods with thick yaupon brush and a public hunting area that is very secluded. We typically hunt between a dirt road and the lake, there are 'fingers' or peninsulas of land. I grew up very close to the Big Thicket & spent my life in the woods but I began to feel uncomfortable in there, unlike hunting or hiking anywhere else. My husband also noticed this feeling of being watched or hunted, as did guest we brought with us. The 1st experience, my husband was sitting on the ground hunting for deer. He saw some movement far up in a pine tree. There are large birds (eagles/hawks/woodpeckers etc) so that's what he expected it to be. But a head and shoulders peeked around, looked at him, out stretched an arm and then it jumped to the next tree over. Then it proceeded to jump from tree to tree approaching towards him. It was small woman/large child sized and too far away to make out much other than its shape. But it clearly was ape-like. He left before it got any closer & we left out of there for the day. No other experiences that year (2016). I dubbed this general area bigfoot's backyard, jokingly. At this point I knew he saw something but I wasn't REALLY ready to call it Bigfoot. We no longer camped out there after that. The next year I was in Bigfoot's backyard walking very slow & quiet listening for squirrels. I was squirrel hunting dressed in camo and was closer to the dirt road than the lake. It was in October and almost dark when I heard this growl (if you can call it that!). It came from the thick brush about 50' behind me. It was the deepest most guttural GRR-UMPH. We don't really have bear here but I fully expected to turn around to a grizzly bear as loud & deep as the growl was, but I didn't see anything. We left immediately. Later in Nov. my husband was hunting a few hundred yards from that spot and something growled & growled at him until he left. Deep deep guttural growling. This was (2017) and we no longer waited until after dark to leave our hunting spots. A couple of acquaintances of my husband, a father & son, was looking for a public land spot to hunt deer. He gave them a tour of the spots off of that dirt road. These guys moved here from bear country, so let that be known. They had tree climbing stands, so no visible ladder from the ground. They go out there by themselves, they pick bigfoots backyard to hunt in. The son arrives 1st and and climbs 30' up a tree. It is the exact spot I was growled at before. A little later the dad arrives. He comes in, crosses a little creek right by the son & goes down toward the lake. It gets quiet then the son heard something walking, he naturally thinks it's a deer. He watched a huge dark hairy creature walking upright on two legs, not just walk in the direction of where his dad went, but walk the exact trail he took. There isn't phone signal in that spot. He told me he wasn't about to move in case it saw him. The dad was never aware he was stalked by bigfoot, climbed up in the tree and didn't see anything out of the ordinary. They never went back. I think that was in 2017, November or December. This year my husband went out there first and hunted bigfoot's backyard and told me it felt comfortable in there. This lulled me into going back out there. I didn't feel comfortable at all. I heard strange whistling and sniffing noises, and the next time, loud repetitive whoop whoop whoop. I declared the woods still had bigfoot & few deer and I wasn't returning anymore. So husband goes a few times by himself. One evening, he sits in a lean-to stand that is maybe 1/8 of a mile from bigfoot's backyard. It has a ladder and is 12' off the ground. This is a new hunting spot and unfortunately a bigfoot hunting party stumbles onto my husband. He is facing a draw with a small creek that runs down to the lake (to his left). The dirt road is through some thick yaupon brush to his right. Behind him and across the draw is thick yaupon brush also. They clear cut timber company land a few hundred yards ahead of him, although it's not visible from the stand. It's a Monday and he is the only human out there hunting, 5:15pm November 18, 2019. He see the back end of a deer go into the woods. It had crossed the draw, had come in down wind and was heading towards the clear cut area. My husband was dressed in full camo, didn't spray scent killer and had in fact gotten scented candle on himself. He hears a strange deep HUM-Phhh from the youpon behind and to his left. At first he thought it could have been a deer, although a strange noise for a deer. It makes a low growing noise and starts moving back & forth in the brush. Its obviously big & heavy. Then it starts UMPH UMPH UMPH very loudly. This makes my husband VERY uncomfortable. Then it does a howl, like a wolf, but cuts it short. Like a 2 second extremely loud howl that just abruptly ends. Hair raising howls. Another abrupt howl answers him from down the draw towards the lake followed by three loud knocks, loud as gunshots. We assume they were tree knocks. Then the one closest starts talking in gibberish. Hearable but not loudly. My husband announces that if it a person playing a joke they are about to get shot at. The gibberish stops and is replaced by even louder growling and it advances towards him. He fires a shot from his rifle towards the growling because at this point he is fearful of being attacked. They start charging towards him. He could see the tops of the youpon parting way. The loud growling and brush was breaking so loud. He shimmied down the ladder and ran for his truck pushing his way through the brush. The two growling creatures stayed just a little bit behind him all the while growling, breaking over small trees & just ripping brush up. They chased him to the road, but never stepped out. He ran to his truck and left. Based on these experiences there are some facts that I truly believe. Bigfoot is a real animal not a mythical creature. It is smart, hunts in pairs or groups and is definitely a meat eating predator, and in this area deer & wild hog are plentiful. It has communicative skills, although primitive. It has a VERY good sense of smell that would rival that of a dog/hog/deer. Their young spend alot of time in the trees. They drive their prey into areas where it is easier to catch, like close to water. They most likely have ""scouts"" when humans are in the area & their family unit is close by. They do not like humans to surprise them and will do their best to scare the humans out of their territory if they deem them too close or dangerous."
66081,Report 66081: Night time road crossing sighting four miles south of Weatherford,Class A,2019-06-13T12:00:00Z,32.64,-97.84,2019,Texas,66081.0,"I had a encounter that happened in July of 2019. I was driving down Tin Top Road, right after Thompson road exit at night and I saw a large black humanoid figure that stopped in the middle of the road, looked towards my car, and after a second, ran across the road."
67199,Report 67199: Daylight sighting on the Brazos River west of Weatherford,Class A,2020-10-23T12:00:00Z,32.66908,-98.03284,2020,Texas,67199.0,"Hello, my name is Ricardo. On Friday the 23rd of October, 2020, my wife and I were seeing if a restaurant in Texas was opened so we could have lunch. It was around 1 pm. The name of the restaurant is called the Catfish Cafe, located just West of Weatherford, Texas on Interstate Hwy 20, right next to the Brazos River. There was only one worker at the restaurant, and he told us that the restaurant would not open until 4pm. So, my wife and I decided to drive around the countryside in that area and kill some time until 4 pm. Immediately just west of the restaurant about 50 yards or so, is a bridge that goes across the Brazos River. We headed across it and stopped in the center of the bridge to look at the river scenery when we spotted a huge dark figure on the river wading in the water around ankle deep. This thing was about a quarter mile north from the bridge. At first we thought it could be a man that was kicking the water, chasing a possible fish or something, but looking at the object a little closer, we knew that it was not a man because it was dark, tall, and hairy. We believe that it was a bigfoot looking for his meal. We stayed there on the bridge for a good 5 minutes, as no cars were coming. We drove around for awhile after that and came back to the restaurant about 3:45 pm stopping again on the bridge to see if that thing was still there. It wasn't, and we then got our food to go and went back home to our house in Weatherford. You guys are the first people we have told about this incident."
69015,Report 69015: Motorist daylight sighting 35 miles north of Austin,Class A,2017-06-24T12:00:00Z,30.77532,-97.93719,2017,Texas,69015.0,"This sighting has stayed with me for a long time.  I didn't want to submit it at first, but based on the number of sightings identified I am now forwarding on what I saw. My son and I were driving down county road 200 in Liberty Hill, TX.  We came to the end and made a right turn on county road 236.  We were heading towards Killeen, TX at the time and it was in the morning. At the time, the car I was driving had two little plastic pieces on the front of it that were designed to create sound to scare away deer.  I got them because my car was a small car and I didn't know if they would help, but as this is an area with a lot of deer, it was worth a try.  I am not sure if this is what scared what I saw. Just after we made the right on county road 236 I saw what I thought was a gorilla on the left side of the road.  It seemed agitated and as we got closer it ran across the road and climbed into a tree on the other side.  At that point I saw the tree move wildly with the leaves and branches swaying like it was extremely angry, or like a strong wind had hit it.  As the day was calm the only thing that could have caused this was whatever jumped into the tree. I didn't look up and I didn't stop due to my son being with me, but that sighting has always remained with me as it was so unusual.  I have seen gorillas in the zoo and it looked similar.  I would say that it was relatively tall and was standing on its hind legs as I got closer to it and as it raced across the street in front of us.  It didn't seem as tall as I would have imagined... maybe 6ft.  It was hard to tell height from where I was in correlation to what I saw. After this event I checked to see if a gorilla had escaped anywhere near me and didn't find anything.  To many this will sound like a tall tale, but to me it was very vivid."
74972,Report 74972: Late night sighting 15 miles SE of Heber City near Hwy 40,Class A,2022-09-20T12:00:00Z,40.29942,-111.2586,2022,Utah,,
45570,Report 45570: Early morning road crossing near Woodstock,Class A,2014-04-03T12:00:00Z,38.90323,-78.48832,2014,Virginia,45570.0,"It was about 4:00 am on April 3, 2014 I was driving to work south on Route 11 towards Woodstock, VA. I saw a tall dark figure move from the east side of the edge of road and go into the brush down into the stream area at Artz road. I estimated its height to be over 7 1/2 feet tall because of a stop sign that it was standing next to and in 2 large bounds it cleared the road and was in the stream area. I have heard of reports of tree knocks and growls in this area for the past couple of years. And since my sighting my wife and I have even smelled wet animal sulfur smell coming near our home in Toms Brook, VA just 3 miles from my sighting several nights over the past couple months. Our dogs refuse to go near the edge of our property at night when we take them out before we go to bed too."
