number,title,classification,timestamp,latitude,longitude,year,State,report_number,observed
44644,Report 44644: Memory told of a daylight sighting near Chauncey,Class B,2014-05-12T12:00:00Z,38.87531,-87.90503,2014,Illinois,44644.0,"I have had two sightings. The first was in July or August of 2002. It was one of those hot, and humid days of summer. Temperatures reached around 100 that day. So my then boyfriend, five year old daughter, his Rottweiler, and me decided to go to the river and swim at one of the many sandbars on the Embrass as some call the Ambraw. So our location was into an area that you would not see people just walking around or being out in. Very secluded very off the beaten path. We were swimming and eating lunch and hanging out when all of the sudden the dog starts going freaking nuts like I never seen. So I go up the incline on the beach towards where my truck was parked to see if maybe it was a farmer that had driven back there for some reason. The incline was steep enough that I could look across the grassy weedy tree area to the edge of a bean field where the truck was parked without anything of me being seen except for my head. When I looked over the edge of the bank right there in front of me, maybe 20 yards away, crossing through the under brush was something that my mind could not grasp. A thin black 7 to 8 foot man like creature. I was so in shock I just dropped down the bank. My boyfriend said what was it? I answered Sasquatch. Let's go!"
44645,Report 44645: Motorist has possible daylight sighting near Embarras River,Class B,2014-03-20T12:00:00Z,38.893,-87.869,2014,Illinois,44645.0,"Sighting number #2 was 3/20/2014. This just happened two days ago. I saw what I never thought I would see again, and how different this one was. Me and my friend was coming back from a road trip south when we decided to go down to a place on the Embarras River.  I like to fish and swim at what's called Spencer's Bridge. This used to be a county road that used to lead to a bridge that crossed the river, but the bridge is long and the area floods so much, no one uses it except for people fishing and swimming. I was going really slow because it had just been grated from the last flood. When in front of me I saw a fast dark moving object, it ran on all fours towards the tree line . When it turned south I could see that it was running on all fours as a ape would but fast. It stopped and turned towards us and you could see that it was dual colored, white on one side and brown on other, different yeah. It was too far away to get any more specific on the coloring but this one was much more heavier and hairier. Couldn't really see just how tall he was but his mass was a lot bigger than the last one I seen but that was in the dead of summer He turned and took one last look at us and disappeared into brush. This would of been about 5 miles from where I saw my first one."
45041,Report 45041: Man recalls possibly seeing a bigfoot playing peek-a-boo in headlights while parked west of Midlothian,Class B,2014-05-14T12:00:00Z,41.63289,-87.79683,2014,Illinois,45041.0,"The following on-site interview was conducted by Stan Courtney. The first name of the witness has been changed. Stan - Jim, can you explain what happened? Jim - When I was about 16 years old, myself and two friends were parked by the woods, weren't drinking or anything, which is an important factor there. I actually saw a hand come around a tree, like you were gripping a tree, or something, but a big furry hand. And being a kid I thought it was a werewolf, the first thing I thought. And I told my buddies and they looked but didn't see it a first. Not even a moment later a big, I didn't know what it was, a big furry head stuck around the corner, peeked at us, and went right back. It didn't charge us and it didn't move. And then we took off from there like wildfire, just flew out of there. But, that is something we never really talked about because we never knew what it was. Stan - What year would this have been? Jim - That would have been in about 1974. Stan - And in summer? Jim - Yes, it would be middle of summer. It was just one of those little Forest Reserve cutoffs where you pull-in, and your car is kind of almost in the woods. Stan - How tall was it? Jim - I would have to say eight foot range. The hand was up there high, that is what caught me off-guard. Stan - And what color was it? Jim - It was a blackish-brown, I just remember seeing a big hand. You would almost mistake it for a gorilla-type thing. It is something that is not natural in Illinois. Stan - And were you able to see the face? Jim - Yeah, have you ever played peek-a-boo with the kids? You know how you do that? It was kind of like that, it stuck around the corner and went right back. I just remember it wasn't a person, eight foot tall and it was all furry, but it wasn't a gorilla face. We thought it was a werewolf, because we were all kids."
45830,Report 45830: Motorist has possible nighttime sighting in the Forest Preserves outside Chicago,Class B,2014-07-11T12:00:00Z,41.7173,-87.8617,2014,Illinois,45830.0,"I was driving home from my shift at UPS at about 4 a.m. last night.  Traveling east on 95th street, most likely before Lagrange road, but I am not certain of which main cross street I was near, because I normally don't take 95th home.  I was still in a heavily wooded area. As we were driving something darted out in front of me, perhaps a block or so ahead, it ran across the street from left (north) to right.  I thought it could have been a person, but it ran across the street really fast, like someone with those fancy prosthetic legs.  As I approached the area, I slowed  down to see if there was someone there, but no person was in sight. Like I said, it was tall, thin, and ran fast, like it only had to take a few steps to cross both lanes."
46917,Report 46917: Motorist has possible nighttime sighting near Hagaman Bottoms.,Class B,2015-01-22T12:00:00Z,39.3047,-90.0775,2015,Illinois,46917.0,"This is the second time that I have seen Bigfoot in my lifetime.  Both sightings have been in the same vicinity.  Here is my story of tonight's sighting.  I was going home from work from Carlinville and was driving west of Illinois Route 108.  As I approached a hill that was just east of the Hagaman turnoff I noticed a tall reddish brown creature crossing the highway going north.  It was at least 7-8 feet tall and was in the standing position.  As I approached the area that I saw it cross I looked in that direction and it was no where in sight.  I want to add that there have been many sightings in this area.  It is in Macoupin County, Illinois and both of my sightings were in an area known as ""Hagaman Bottoms"".  There is a creek there and it is a wooded area.  The sighting occurred at around 5:15 p.m. and it was still daylight but it was getting dark at this time due to daylight savings time ending this past weekend."
47412,Report 47412: Motorist has possible night time sighting near Plainview,Class B,2014-12-27T12:00:00Z,39.2038,-89.9758,2014,Illinois,47412.0,"On December 27th, 2014, I was traveling home at approximately 11:45pm. I was near a wildlife area when I observed a large figure standing next to the treeline approximately 15-20 feet from the road. This figure was very large, broad shoulders and standing on two legs. I believe that I observed the backside of this figure as it was walking into the treeline since I could not see eyes in my headlights. I quickly stopped my vehicle to look at what I just saw but at that point my headlights were past the figure and I couldn't see anything. The location of this sighting was about a quarter mile north of the Creek bottoms. I quickly left the area to continue my trip home since I was alone."
47469,Report 47469: Memory told of possible vocalizations and footprints found near Atwood,Class B,2015-01-02T12:00:00Z,39.8352,-88.47835,2015,Illinois,47469.0,"The following incidents occurred between the years 1984 and 1986 around our woods which is located just south of the intersection of E300 N Rd 300 and county road 1425 Northwest of Atwood Illinois. At the time we lived in the 15 acre woods which is at that location. The Lake fork river runs just behind that woods and there is a bottom land just north of the woods which floods every fall. At the time I was a teenager and hunted, fished and trapped along a several mile stretch of that river. The encounters we had were not visual. The first instance was about 10pm on a winter evening when I was going to let our poodle out before turning in for the night. There was only what I could describe as a combination of a Scream/howl which came from just on the North side of the house. Our dog was so frightened it would not go out of the door. He was not afraid of anything and to see that fear in him was shocking. The volume of the howl was immense. My mother was home and heard it as well. Even from inside a well insulated Illinois home it sounded as if it was right next to you. I had the door open and it felt like I had been hit in the chest by the sound. The second instance was just south of that woods about a half mile down from where the river bends. I was returning from hunting about 5pm in the evening and heard the exact same howl. It came from the smaller wood which is right next to the river just south of our woods. The 3rd instance was a series of footprints along the bank of the lake fork river. Just to the west of the road intersection mentioned above, the lake fork passes under a bridge. Just south of that bridge the river bends and flows east. I was fishing along that bend on a spring day about 10 in the morning. I felt that there was something not right and then realized that there were no animal sounds. Typically there are all sorts of sparrows and red winged black birds, but there was nothing. I looked down as I was walking and noticed that I was walking next to a line of footprints in the mud. I wore mens size 12 hiking boots and these prints were 5 toed and 2"" wider and 3"" longer than my boots. They were very fresh with dirt still loose on the edge of the track. I looked up and down the river but did not see a thing. The river banks in that area are steep with tall grass. The forth instance was while deer hunting on the east side of the large woods just to the north east of that bridge. I had gone out bow hunting and had set up a blind on the east side of the woods. I had walked from our house and was set up in a blind in full camo by 45mins prior to sunrise. Just before light I heard the same howl which I estimated came from about 50 yards away to my north. It was so powerful that it shook me. I waited for several minutes and it howled again. Only having a bow and not a gun I literally walked backwards the few hundred yards back to the county road with an arrow knocked and ready to go. Not that it would have done any good. You could tell by the volume of the scream/howl that this was a very very large creature. The 5th instance was around 10:30 at night in the back of our house. We kept a large horse tank in the back where we would dump and burn trash. It was approximately 35 yards behind the house. I was taking the trash out and had just dumped it when I heard a ""Hmph"" from the edge of the tree line which was about 10 yards away. I head another ""Hmph"" and then something large taking off down the side of the hill towords the bottom land, I headed quickly in the house. The next morning I checked the area and could see the same size prints mentioned above. I couldn't see them clearly as before due to thick ground cover of leaves. The Howls around our house were heard by my mother. I do not know of any other people in the area having the same instances. at the time there were only 4 families living in that area. Us, my uncle who lived across the river, a family that lived in the house by the bridge and another that lived just east of the road intersection mentioned above."
47521,Report 47521: Possible early morning sighting in Palos Park,Class B,2017-01-22T12:00:00Z,41.67433,-87.84415,2017,Illinois,47521.0,"In the early morning in March of 2013 just before sun up I was at 119th and Kean Ave, Palos Park. I was on the side of the road facing north in my rear view mirror I seen a tall black figure walk behind my vehicle it crossed the road in 3 strides. I thought it was a early morning person out for a walk. As time went by I noticed the walking trail was in front of me not behind me.  Behind me was all guard rail and a steep drop off which later I tried to walk but found most impossible."
47720,Report 47720: Possible footprints in the snow found in Bedford Park (with photos),Class B,2015-01-19T12:00:00Z,41.7627,-87.7714,2015,Illinois,47720.0,"As I was performing my regular pest control service to facility, I found trails of what looked like big prints with what looks like toe imprints. I took pictures along with a video segment. Try to follow the print but lost it due to trail ending in patches where no snow was on ground. I didn't see any thing visually as far as animal or human at time of finding but I have seen deer, jack rabbits and coyotes in these areas. Note: I would love to forward video and pics..."
49182,Report 49182: Memory told of a possible childhood encounter at Georgefield Barracks,Class B,2017-01-24T12:00:00Z,38.76417,-87.60555,2017,Illinois,49182.0,"In 1953 I was a 10 year old girl living in George Field (Barracks), IL. George Field was a WWII air base for pilot training & the barracks housed airmen and brass. After the war the Barracks were converted to civilian apartments & my family lived in one. George Field was in an extremely remote area between Vincennes, Indiana & Lawrenceville, Illinois. The Wabash River was east close to Vincennes and the Embrass River was west - the rivers approximately 20-30 miles apart. The Barracks were surrounded by miles of corn and wheat fields. Often during the night I heard high pitched screams like a woman being attacked or killed. My parents told me the screams were panthers – I never saw any panthers. My sisters and I walked the corn and wheat fields as often as we could. Old timers told us to be careful of the “Grassman” which I later learned was their name for Big Foot. I thought Grassman was like the Wizard of Oz Scarecrow. One night my parents went out and left me with my older sister (who has since passed away). She was always teasing, aggravating and pulling pranks on anyone foolish to fall for her drama! That night she came close and said to me “Judy, there is something outside the window. Seriously, there is a monster outside came to the window – listen, you can hear it.” To shut her up I moved to the window and listened. (Our windows were usually open because we had no air-conditioning) I could hear something large moving around and saw a large head in the shadows. It walked around all the windows trying to look in and went from the back of the house to the front. Meanwhile, our middle sister came home – I knew she’d be coming in the front door where the monster was. I gathered all my nerve, opened the front door, turned on the porch light and screamed to my sister there was danger out there. I found myself looking eyeball to eyeball with the “Monster”. I am now 71 years old and know it was Bigfoot, which I didn’t know at the time. It had honey blonde hair and beautiful amber colored eyes. We startled each other, but it had an “Oh Shit” look on it’s face. My sister who had just returned home came running toward it and it turned to leave. My sister and I looked at each other for a second and “Bigfoot” was gone – disappeared instantly. Neither I nor my two sisters ever talked about it – we all forgot it – never told our parents or anyone. My memory of this incident never came back. 61 years later I started watching your T.V. show “Finding Bigfoot” – I’ve always had an interest in these creatures. It was like someone threw a switch and I remembered. I asked mys sister if she remembered anything and it came back to her. She remembered me screaming and also her chasing this “Bigfoot” thing. She said she chased it because I was hysterical and scared to death. I asked her if she ever told our parents or anyone and she said “no, she had also forgotten about it.” How can this be after 61 years? I think we were both so terrified our minds simply suppressed what we’d seen and your T.V. show was the trigger that restarted my memory."
50965,Report 50965: Possible footprints found and cast east of Belleville near Illinois Route 4,Class B,2016-01-27T12:00:00Z,38.4335,-89.7915,2016,Illinois,50965.0,"I found tracks and video documented them as well as cast them....this is the second time finding tracks , first time was in June of 2015 then January 15 2016...no actual sighting but have heard unusual howls throughout the year since March of 2015"
50967,Report 50967: Possible footprints found east of Belleville near Illinois Route 4,Class B,2016-01-27T12:00:00Z,38.4326,-89.79143,2016,Illinois,50967.0,I heard crashing in the woods I was walking through to get to a field I hunt Indian artifacts in.. and found tracks...
51417,Report 51417: Possible early morning sighting near Glenwood Woods,Class B,2016-03-14T12:00:00Z,41.53887,-87.62597,2016,Illinois,51417.0,"Chimpanzee noises at work. Went outside, seen in hedge apple tree. Tan reddish hue, wedge shaped head from behind. Went away after I yelled, still heard noises."
55144,Report 55144: Hunter describes strange encounters and finds a possible footprint near Kickapoo State Park,Class B,2015-11-12T12:00:00Z,40.09169,-87.71541,2015,Illinois,55144.0,"It all began with my father in law. He had an encounter of something huge and making an un familiar noise he said he had never heard before. He is a 70 year old man and great guy. I recall laughing and making fun of him. Then the tables turned, I was in the woods alone hunting in the 2015 hunting season.I was in my stand and had several deer come in but they seemed very skidish. I drew my crossbow down on a nice buck and pulled the trigger. My arrow seemed to find its mark. I allowed about 45 minutes to go by and it began getting dark. As I climbed down out of my stand I began hearing some unusual noises. Kind of like I screaming growling noise. Now I'm soon to be 50 years old myself and as my father in law said to me. These were sounds that I had never heard before in the woods or anywhere else. I called my father in law and told him I had a deer down and asked if he could meet me out in the woods to help me get the deer out. He told me he was in Terre Haute Indiana, and that it would be close to an hour before he could even get home. I was too embarrassed to tell him I too was feeling pretty uneasy. I tried to keep him on the phone but he had to get off the phone.so I began tracking the deer I found really good blood. And was sure the deer didn't go far. As I started down a small hill I began hearing these noises again. It was as if I could feel these screaming growling noises in my body. I kept hearing what I thought may have been falling tree branches or something. I looked up on this hill side 30 yards from me and seen a sillhouette of something huge. I quickly headed out of the woods and continued hearing the noises all the way out. I called my father in law and told him about my encounter. He laughed and said you mad fun of me. We returned the next morning to find the blood trail  where I left off and we knew the deer had to be close due to the amount of blood. And then it was as if the deer just vanished.. We began working in circles to find nothing. There was a steep cliff to the east of where we found the last blood. We looked down torward the creek to find nothing. But the smell in the woods was as it was the night before. A very strong pungent odor. Kind of a cross of something dead and the urine of many different types of animals. I felt eyes on us the whole time we were out there. We went back several times without success. Then in April I went out to the same location mushroom hunting, I found that the woods was  very quiet. I didn't find any mushrooms so I headed out through the North end of the woods to look at deer sign. When it hit me, the smell it was so strong , I began hurrying to get out of the woods as I got to the edge of the woods to an area we call the  grassy area and there it was a foot print. A single foot print it was the left foot and was very large . The print was a good one very detailed you could see the toes and everything.I wear a size 13 and this print was way bigger than my foot. This area is about three miles from the Kickapoo state park in Vermilion county Illinois. I have never been frightened in the woods in all my life. I spent my whole life in the woods hunting most of every species in our area. I coon hunted in the dark by myself and never been as frightened as I was with this encounter."
55386,Report 55386: Witness recalls possible nighttime sighting near Sparland,Class B,2016-08-16T12:00:00Z,41.02524,-89.45454,2016,Illinois,55386.0,"My mother and I had a possible sighting back in about 1974. We used to watch for my step dad to come back from deer hunting. Depending on the moon light, we could see him coming down from the woods. One night my mom said that he was coming. We went outside and we both thought we seen him walking to the house. Mom walked out to meet him. I stayed on the back porch and watched. It was probably 9pm or so. What ever it was just stopped and stood there. Then it went back into the woods fast. Mom ran back inside the house with me by the wrist. She locked the doors and loaded a shotgun. My step dad eventually got home. Whatever that was walked on 2 legs. It was not my step dad. We live just outside Sparland, Illinois."
56168,Report 56168: Possible nighttime sighting along Scott-Troy Road south of Troy,Class B,2017-01-20T12:00:00Z,38.66736,-89.87602,2017,Illinois,56168.0,"I was driving along Scott-Troy Road after work one night. It was around 8:15 pm when I was driving through some wooded parts of Scott-Troy. I saw something large, black and hairy take two-three giant bounds across the road before it disappeared on the other side. I slowed for a bit, trying to see what it was, but it was too dark to see what it was or where had it gone."
58089,Report 58089: Motorist observes possible nighttime road crossing near Troy,Class B,2017-08-19T12:00:00Z,38.74625,-89.8774,2017,Illinois,58089.0,"My friend and I were driving home in the evening. As we came around the corner we observed a large upright animal standing in the middle of the road.  It took several steps and went into the woods. It was grayish-black in color and stood about 7 feet tall. I couldn't see the face very well because it was covered with hair. My friend said she didn't believe in such a thing as bigfoot but I told her ""well, it was standing right in front of us."""
65795,Report 65795: Motorists' sighting of a possible sasquatch along Interstate 64 outside Mt. Vernon,Class B,2020-07-21T12:00:00Z,38.32304,-88.96978,2020,Illinois,65795.0,"My wife, daughter and I were traveling on interstate 64 about 40 miles southeast of St. Louis. It was late at night when I noticed a big figure walking along the tree line. As I was passing it turned and looked at me with big glowing eyes. It turned into the woods to maybe one or to steps and looked back. There's no doubt of what I saw."
