number,title,classification,timestamp,latitude,longitude,year,State,report_number,observed
65305,"Report 65305: LAST WEEK: Fishing couple reports whoops, bipedal footfalls, tree pushover while night fishing in Egypt Valley.",Class B,2020-04-11T12:00:00Z,40.10084,-81.14331,2020,Ohio,65305.0,"On the evening of April 7, 2020, we decided to do a little catfish fishing at a creek off of Piedmont lake in Egypt Valley. We backed our truck up to the water, dropped the tailgate, built a fire and started fishing. This was around 9pm. The moon was so full we didn't need a lantern. It was very still and quiet out until we heard a few coyote's howl followed by some frogs croaking. Across the creek was thick with brush and small trees, there was a path that looked like led down to the water. While sitting on tailgate, we started to hear a sound of something walking down the side of the creek. You could hear it slowly taking what sounded like a two beat step. Too heavy for a deer, and too small for a coyote/cat. It hesitated at the pathway, then continued on to the left of us. It then made a loop to the right and came back up only farther away from the bank. Then we heard a hoot owl like sound very close to where we first heard the brush cracking. Then another hoot farther to the right as we could hear the footsteps fade in the distance. Then, about 5 minutes later, we heard a tree fall to the right of us across the creek where we heard the footsteps and hoot sounds. After all this the frogs started croaking again. We fished a little longer and decided it was time to leave."
65393,Report 65393: Possible knock heard from Little Miami Bike Trail near Ft. Ancient,Class B,2020-04-12T12:00:00Z,39.42606,-84.10463,2020,Ohio,65393.0,"I was on the Little Miami Bike Trail heading back to Morrow from Oregonia...mile marker 23.5. It was Sunday, April 12, around 5:00 in the afternoon. Since the Covid restrictions were enacted a week or two prior, the trail had became so crowded every day of the week. However a cold front came in and it was a cool, cloudy day and very few people on the trail...maybe 15 to 20 riders encountered from Oregonia to Kings Mill...well, maybe more, but not bad. I'm retired and ride this route nearly day, weather permitting. So, after passing under the former Jeremiah Morrow Bridge (I-71 over Little Miami river) there's a long gentle arc in the trail. I haven't seen a soul since I turned around at Wilmington Rd. I'm cruising, it's nice and quiet, when suddenly I heard a loud knock...so distinct I instantly said in my head...that was a knock! It came from atop the hill to the east. I pondered all the conditions, i.e; kids playing..not!, cold, remote, and they don't play in woods anymore,..adult messing...maybe, but how would they know I was there?... natural, very doubtful, I'm nearly 68 and never heard anything so crisp, clearly, like a Louisville slugger full speed against a barkless solid ash tree (I imagined). There...that's what happened. I look online to see if any Bigfoot sightings had been reported in this area and found none. I stored the incident away until last weekend when I was talking to my son. He's 46 in May, I raised him near Morrow (abutting the former Frisch's Farm on the 3-C highway). Our school district includes the Maineville area. One of his good friends lived on a hillside, at a 90 degree curve on Sibcy Rd. His friend, Chris Flick's older brother told Nick, 20 years ago, he and his dad both saw a Bigfoot walking through the woods on the opposing (their house) hillside...two different times. Nick said he never related this until he told me...because of my knock story. He said he'll never forget it...and because of his story, I tell you my story...There! Thanks for reading, and hopefully you consider. Dan"
69304,"Report 69304: Salt Fork boaters hear a loud, deep howl (""Ohio Howl"") from adjacent shore.",Class B,2021-06-08T12:00:00Z,40.07849,-40757860.0,2021,Error,,
69398,Report 69398: Two men find unusual brush structure while deer hunting 10 miles east of Cambridge,Class B,2021-07-06T12:00:00Z,40.01452,-81.34529,2021,Ohio,69398.0,"What myself and brother in law found was a structure built of mainly blackberry vines. We were scouting for deer on an abandoned farm in an area that had been stripped for coal 35yrs prior. Deer were plentiful, but not as much as present day. When came across it when we both were following a path that materialized and split in two directions around a spoil bank. My brother in law went one way I the other, both paths lead to the top of the spoil were we came on the structure. We were in total amazement noting it was kind of an igloo shape with an opening to enter. The briars where woven together to form the walls and the inside had been cleared like it had been mowed. We stood amazed at what could have made it. We had never heard much about a Bigfoot at that time. Nobody in they’re right mind would have been in the area fighting thorny vegetation and biting insects to create such a thing. Than about a month later the same brother in law and his cousin were walking out of a hollow near dark when they heard the strangest animal they had ever heard. When they would try to tell the family about it they got laughed at. Neither ever forgot it  or entered the property in the dark. It wasn’t until maybe 20 years later when I happened on a Bigfoot program showing such a structure that a bell went off as to what we’d saw. Also around the time other people had reported seeing things peeking in windows around the county"
69411,Report 69411: Long distance daylight sighting by farm owner 5 miles south of Ashland,Class B,2021-06-09T12:00:00Z,40.81139,-82.26806,2021,Ohio,69411.0,"The incident occurred on June 9, 2021 at approximately 5:15pm. It started raining around 3:30pm and ended around 5pm. I had to get the grass mowed because it was already too long. Usually, when I mow, I have my cellphone in my shirt pocket. But, since it rained, I didn’t want to take the chance of it getting wet. So, I left it in the house. I was mowing in the direction of north to south. There are several large farm fields behind my house. In between these properties are three large depressions in the landscape where a large vehicle could park in there and no one would see it. Through these particular spots are cart paths that run along the bottom (also running from north to south). As I was mowing, a dark figure appeared down by the corner of one of the fields, approximately150-200 yards out. I stopped and looked and was wondering if it was the neighbor checking his trail cam that points to the north. I took my mower over to the wood pile which is approximately 35 yards closer, to get a better view. The field was just planted with soybeans, so I couldn’t go in the field with the mower. At that point, the dark figure was just east of the trail cam and I was hoping it would cross the path of the trail cam, but it seemed to avoid that area. This dark figure was following the deer trail that are 40 yards east of the trail cam. I asked myself, “What am I looking at?” knowing it had just rained. Who would be back there?” I idled the mower down and noticed the toadstools around the wood pile and thought maybe it was a mushroom hunter. But, this “person” was black from head to toe and mushroom season is basically over by now. This large figure started to move across the second field heading northeast along where the deer usually go, down into the large depression in the field. As it was moving across the field, I knew there was no way I would have enough time to get my cell phone or binoculars in time to view it.  I sat there and observed it following the deer trail...knowing it was not a black bear walking on two legs. The whole time I was thinking, “No one is going to believe me”. It seemed to cross the field without any trouble and cleared the field within a matter of a minute and a half. As it disappeared into the chest-high weeds, I sat there for approximately five minutes waiting to see if it would appear on the other side or head toward the large section of woods which have several trail cams along the perimeter of the woods. I also scanned the treeline for any vehicles that might be there from someone out walking, but there weren’t any. I could not figure out what I had just seen. I finished mowing and didn’t even tell my wife about it until a few days later. At my first opportunity, on June 12th we took our golf cart back into the area to see if we could find any prints or tracks. To our disappointment, the field had been no-tilled (Roundup) where the field was filled with weeds, grass, and corn stalks where it made it very hard to find footprints. We also followed the path that it took up to the large part of the depression in the field where you can see game trail going in and out of chest-high weeds. We also took the cart down into the lower part of the depression via the mowed paths that are back there. On June 13th, we conducted a re-enactment with our 15 year-old son. He is about 5’11” and 235 lbs. We had him dress in a black Adidas sweatsuit that had white lettering and stripes on it. My wife took him on the golf cart to the area where I saw the black figure. I sat back at the wood pile on my mower to watch for him. Through cell phone conversations with my son, I had him put up his hood and walk the same path, three quarters of the way through the field, all in black. My first observation was that what I saw on June 9th was much bigger and moved through the field easier than my son did. He was trying not to walk on the newly planted soybeans and trying to miss the old corn stalks in the field. Because of this it took my son longer to cross the field. He was close enough that I could actually see the white parts of my son's sweat suit with no problem. Because of that, I know that what I saw was all black. Note in May, we saw less deer in the area possibly due to the farmer tiling the field. And for the month of June, we have taken cart rides and have seen less deer in the area. I haven’t told too many people for fear of being made fun of. My wife didn’t really believe me until we did the re-enactment. She even says that there is no way you could miss something all black from head to toe back there. I just can’t seem shake it from my mind."
69469,Report 69469: Couple returning home spots a bigfoot crossing their driveway outside Columbiana,Class B,2021-07-17T12:00:00Z,40.91197,-80.70913,2021,Ohio,69469.0,"Through the years I have had several sightings and interactions with what appears to be a bigfoot and family. We own the better part of mystic woods in Columbiana OH. When the gas and oil companies started installing pipelines years back we started having encounters. I’m an engineer by trade and my wife is a banker. Tonight yet another sighting by our pond.  My wife and I were at dinner and as we arrived home about 8:30 PM a very large fast gray/ silver lite brown (covered in fur/hair) bigfoot darted from bushes in our front into the cat tails in our pond on all fours. We both looked at each other and said did you just see that?!!  The subject was down low and bent in the middle as it moved. Unlike a dog, it’s undulating movement was not as fluid as a dog. It was not a bear. It appeared to be from 4-5 feet at the back and torso built like a barrel. When it went into the cattails we were no longer able to see it."
69490,Report 69490: Missing chickens lead to discovery of large footprints by chicken coop near Bloomingdale,Class B,2021-07-24T12:00:00Z,40.36887,-80.81801,2021,Ohio,69490.0,"On July 9th at approximately 10:00 A.M. I noticed my five chickens were missing. The chicken coop was full of feathers but no bodies or blood. I did a perimeter check and came across an extremely large footprint. I went back to the house and brought down a tape measure to the footprint and measured it and took pictures with the tape measure beside it. The foot print measured Length: 18"" Width: 9""-10"". On the 23rd of July, Jim Thompson BFRO Investigator of Ohio had contacted me and came out to investigate. During Jim's first visit he found four more footprints near the original footprint. Jim stated that the other footprints were about four feet spread apart from each other. On July 24th at approximately 12:38 A.M. I heard a sort of yelping noise coming from one end of my property and heard a quick response (same type of noise) come from the other end of my property. At night time every now and then on my property I get an eerie feeling that something is watching me."
69588,"Report 69588: Long, loud whoops heard at 2:30AM heard on southern outskirts of Wadsworth",Class B,2021-08-14T12:00:00Z,40.9994,-81.71439,2021,Ohio,69588.0,"On August 14, 2021 I was sitting outside watching the Perseid meteor shower when I heard two “whoops” off in the distance. No long howl, just two “whoops”. It was about 23:30 hrs. on a dark night. The sounds sent all the hair on my arms and neck to stand up. The sounds came from the southern part of Wadsworth, Ohio. South of Johnson but north of Wall Rd. I immediately went inside and began to search the internet for similar audio examples of what I heard, for comparison purposes. I located sounds on the internet of alleged Bigfoot that were eerily similar to the sounds I heard on August 14, 2021."
71751,Report 71751: Possible sighting in Mohican State Park near Loudonville,Class B,2021-06-18T12:00:00Z,40.61309,-82.31692,2021,Ohio,71751.0,"It was June 18th, 2021 about 4:00 pm at Mohican State Park, Loudonville, Ohio in Ashland County. My best friend and Idrove into the picnic area at the Covered Bridge, and there were no campers, hikers, or people fishing, so we drove into Campsite B, its a narrow road that is parallel to the Mohican River. Then we reached the end of this road where there is a turn-around, so we parked the car and shut off the engine. The front of the car was facing towards the Covered Bridge and the Mohican River was on the driverside of the car, and the thick woods were on the passenger's (my side) and to the rear of us. Also, it was an unusually chilly day for the month of June and it was very cloudy, with no sun and a slight drizzle of rain. So, we sat in the car with the windows down, we could hear birds chirping and the soft babbling sounds of the river. We sat there for about 30 minutes, talking away as women do and I mentioned that I watched a Bigfoot show on tv and we should do ""bigfoot calls"". So, jokingly I started doing whoop whoop calls and it echoed in this small area, we laughed for a couple of minutes then took a drink of our pop and we heard two tree knocks, not loud but not soft. Instantly, I was scared because the sound was very close to us, it was about 30 feet up in the thick woods, and it was very steep, almost straight-up. I knew this was not a person because it's too dangerous to climb. This spooked both of us so we started the car and went back to the Covered Bridge picnic area which is more of an open area. Also, there were a few cars so we did not feel alone, and my friend had to use the restroom and I stayed in the car. The woods were still on my right side and I could hear birds chirping loud and fast then all of a sudden they stopped. Then a rock that was about 6 inches wide came tumbling down on the ground of this steep cliff along with dry leaves falling behind it. So I looked up and about 15-20 feet away I saw the left side of a foot, calf, thigh, and hip of an animal. It looked like it was slipping on the leaves and was trying to gain traction and its leg went straight up and behind a tree. This leg looked like a bodybuilder's leg with short black hair and was about 3-4 feet in length. Then my friend got into the driver's side of the car and we left. So, when I got home I looked up videos on youtube of bears. My leg sighting does not match a bear leg because the hind leg of a bear or dog has an odd angle from the pad of the foot to its leg. But what I saw was a human-like foot with hair that connected to a calf, to a knee, to a thigh then to a hip, and it was super muscular. Also, there have been NO bear sightings in Mohican State Park for many decades."
75464,Report 75464: Multiple witness daylight motorist sighting at bike trail half mile west of Fort Ancient,Class B,2023-02-28T12:00:00Z,39.40836,-84.10006,2023,Ohio,75464.0,"As we were driving along State Route 350 toward State Route 123 south of Oregonia, we came to the Loveland Bike Trail that runs next to the Little Miami River. As I slowed down near bike path crossing, we looked out the passenger side of the car and saw a large black figure standing [a distance] up the bike path, facing the river, while it was snowing. The ground was covered with at least three inches of snow so it didn't appear that someone would be on the bike path biking or walking the trail. The weather was not ideal for anyone to be hunting or walking on the path at that time. The figure appeared to have come from the woods and was walking toward the river. It was difficult to estimate the size of the figure when they saw it. It didn’t appear to be a hunter as they would have been wearing an orange vest, or at least an obvious clothing pattern."
50756,Report 50756: Family hears ape-like sounds close to a dam on the Neosho River near Pryor,Class B,2015-06-15T12:00:00Z,36.22935,-95.2419,2015,Oklahoma,50756.0,"In June 2015, I, my wife, and son, were out at 10:00pm south of Pryor near low water dam on the Neosho river. As we drove the back roads, I stopped my truck and immediately heard a loud ""ape like"" sound coming from the tree line that was appropriately 15 yards to our left. We shone a light in the area for about a minute. I back my truck up 20 feet and stopped and we heard a second louder ""ape like"" sound from a second location in the tree line. The ""ape like"" sound was a short whooping noise. The second noise was loader and more aggressive sounding than the first noise. We stayed in the area for several hours with no other incident."
65284,Report 65284: Campers awoken by loud knocks around 4am near Talemina Scenic Drive,Class B,2020-04-03T12:00:00Z,34.4415,-94.4325,2020,Arkansas,65284.0,"Went camping in the Ouachita mountains near Talemina Scenic Drive.  At 3:39 we all woke up due to the sound of something knocking a tree behind us. Was in the distance but close enough to make you on edge. We thought it was a woodpecker and brushed it aside. 10 minutes later we heard the noise on our right side of the tent. The knocking was in triples such as “ knock, knock, knock” then a pause and the 3 knocks again, but in every direction the knocking had a slight variation. The knocking was coming from all sides of our tent, as if there was something surrounding us communicating. Knocks has slight variations in how quick they were, but all of them had the triple knocking. The closest knock was about 50 yard uphill from us. The close one made everything stop in the woods, it was raining and it stopped along with the wind. This is weird  considering it was super windy up there the whole time we stayed, except that one moment. We all agreed to not camp that spot again."
66198,Report 66198: Possible knocks heard by hunter before sunrise NE of Collinsville,Class B,2020-10-16T12:00:00Z,36.37919,-95.80589,2020,Oklahoma,66198.0,"Date of Experience:  10/16/2020 Time of Experience:   6:15 am Location of Experience:  Collinsville Oklahoma Personal Property. I went archery hunting on my 11 acres on 10/16/2020 and as I approached my tree stand around 6:00am I noticed a tree that was by my shooting lane had been pushed over.  The tree was approximately  2 or 3 inches in diameter and absolutely no strong winds to push it over the whole week while I was hunting.  I do know that it was standing and not pushed over the day before. Seemed strange but continued to harness up and climb into my deer stand.  Still being very dark that morning I nocked an arrow and settled in to my stand.  Approximately 15 minutes after I shut my headlamp off,  I heard a distinct knock on a tree about 100 yards or so from my tree stand deep in the woods.  It sounded like someone hitting a large stick or baseball bat against a tree.   It knocked about 4 times then stopped and a few minutes later it knocked two times.  It was the strangest thing I have ever heard and the first time I have ever experienced it.  I know that nothing could have made that sound other than a person.  I’ve been an avid hunter all my life and have been in the woods many times, but never before have I heard anything like it, and hope I never do again."
67746,Report 67746: Couple describes strange loud animal vocalization near Beavers Bend State Park,Class B,2020-10-26T12:00:00Z,34.0775,-94.4095,2020,Arkansas,67746.0,"My wife and I traveled from our home in the Dallas area for a 5 day trip to Hochatown, OK on Oct 26, 2020. It had rained all day and had gone to drizzle by the time we arrived at our cabin around 4:30 pm. We unlocked the cabin and went inside and looked around and then went out right before 5 to start unloading our SUV. My wife grabbed some items and headed inside. Right as she got inside I heard a siren go off in the area of Beavers Bend State Park to warn about water being released from the dam. Immediately I heard a load deep growl. After a few seconds the growl turned into a deep howl. This went on for about thirty seconds and was immediately followed by a loud high pitched scream. This was followed wooooing sounds that lasted about 2 minutes. My wife came out while this was going on. We didn't discuss it as I didn't want to tell her what all I had heard. We grabbed up some items and went into the cabin. Upon coming back outside the sound was gone. I heard the siren go off many more times while we were there but never heard any other sounds. I am an army veteran and also former scoutmaster and have spent a lot of time in the woods but have never heard a combination of sounds like this. I'm still not certain if this actually was one or a coincidence of several animal calls occurring one after the other. My wife thought the woooing sound was wind blowing in the forest when we discussed this after we got home. But at the time there was little to no wind blowing and we never heard that again although it blew quite a bit as it rained the majority of time we were there. I originally sent this sound combination to Cliff Barackman and mentioned the Ohio howl and after looking it up it did sound similar to that. At the time I hadn't really thought much about Bigfoot since back when I was in junior high in the 1970's but after this have become really interested in it after this."
71794,Report 71794: Possible daylight sighting by motorist 11 miles west of Honobia,Class B,2021-10-30T12:00:00Z,34.50572,-95.12156,2021,Oklahoma,71794.0,"Driving down the road headed towards Honobia, I topped a hill. I was on a long downhill then a long uphill into a left hand turn. As I came over the hill, in the distance at the top of the next hill, something reddish brown crossed the road. It didn’t appear to go straight across, more at a diagonal from right to left with right being the farthest point left being the closest. When I first picked it up in my sight, because of the coloration, my brain said dog. By the time it was out of sight, I realized it was on two feet. It happened in a few seconds. It went across the highway very fast. I was late to my destination so I just slowed down in the area to look. Once I got to where I was going and unloaded my gear I went back and spent about an hour walking up and down both sides of the highway to see if there were any tracks to indicate what I had seen. While doing this a person stopped to see if I was having trouble and needed assistance. When I told him what I was doing his response was “yeah you get a lot of that here.”"
74715,Report 74715: RECENT: Early AM Sasquatch howls near Broken Bow Lake,Class B,2022-07-16T12:00:00Z,34.13716,-94.69904,2022,Oklahoma,74715.0,"My husband and I rented a yurt in Beavers Bend State Park on July 15, 2022. Our Yurt sits directly on the Mountain Fork River. We stayed up until midnight and headed to bed. Around 2 am we woke to the sound of 6 or 7 consecutive howls over a 3 minute time span. It was very loud and east of our yurt. It was then silent. 30 minutes later we heard 3 loud hollering vocalizations much closer in the other direction, to the west of us. We have spent a lot of time in the woods. This is a sound we’ve never heard before. It was not a bear growl. It was not a coyote or a bobcat. This was loud."
74818,"Report 74818: Big howls heard by property owner, stones throw from OK/AR border near Mena AR",Class B,2022-08-12T12:00:00Z,34.64856,-94.46039,2022,Oklahoma,74818.0,I have lived in the area east of hwy 259 and hwy 63 also known as Big Cedar for 36 years. I was outside my home and I heard 7-10 howlings to the north. It was a sound I've never heard in the area before. I've spent considerable time in these woods. Hunting fishing as a teen I would camp alone with my squirrel dog. The only time I've heard anything like it was on TV during the big foot shows. I wasn't going to make a report but while reading some of the reports. I came across repot #34657. In early summer 2007 I was headed north from Big Cedar on 259 and saw a tall dark figure cross the hwy about 1/2 mile ahead of me. It was one solid dark color from head to feet. Bipedal with long arms. Extremely dark brown to black. In almost the exact same place as seen in report #34657. Time was around 10 am.
