number,title,classification,timestamp,latitude,longitude,year,State,report_number,observed
75309,Report 75309: Daylight road crossing sighting of a Sasquatch 65mi NE of Valdez,Class A,2022-05-15T12:00:00Z,61.96802,-145.3427,2022,Alaska,75309.0,"This past spring at approximately mile 106 Richardson Hwy, traveling to Princess Hotel for breakfast on a Sunday morning, about 1/4 before the right turn to Princess Hotel a very Large 2 legged CRITTER ran across the road in front of me and my wife. In 3 steps on a dead run was into the ditch and into the timber. Wish the snow would have been on the ground, but ditches weren't mowed yet.  No visible tracks just brush pushed down. Never seen anything afterwards till late summer in August, watching TV late evening I started hearing noises and thought my surround sound was on, muted the tv, randomly heard it, sounds like a wood knock, and frequently I went outside and it was coming from behind the house. I live at mile 109 Richardson, and no neighbors in that direction for quite aways.  It kinda freaked me after. I knew what it was but after that I haven't heard anything since.  I always carry a sidearm when cutting firewood or just out riding. I truly believe we have a Bigfoot in our area"
44487,Report 44487: Memory told of a close dalylight observation outside Alexander City,Class A,2014-03-30T12:00:00Z,32.91874,-85.9793,2014,Alabama,44487.0,"Not a good writer, but what happened to me and a friend  - we were walking down an old pulpwood road with his german shepherd  and got a strong smell like a goat and stopped my friend. I walked ahead about 20 ft and said it might be a big rattle snake, about that time I heard leaves rustling and it got louder and a tree about 6 inches around shook back and forth about 2 feet each way and I heard the leaves moving like something was running away. I pulled some branches back and there it was, about 20 feet running away on 2 legs at a very fast pace. It was about 8 feet tall and I could see its muscles in its legs moving and the whitish skin under the 3 inch black hair. Long arms no neck as plain as day. My friend never saw it and didn't believe me. But it changed my life. Would like for someone to call me. Two weeks later in the dentist was an outdoors magazine with the Patterson film in it."
44849,Report 44849: Sightings at night in the same area off Bone Camp Road near Northport,Class A,2014-12-27T12:00:00Z,33.37095,-87.6942,2014,Alabama,44849.0,Was driving home at night about 9:00 pm. Turned on Bone Camp road from highway 171 and saw a large figure standing in the brush. As I turned on my brights it had taken off in the brush. This is the second time I've seen this thing and a friend of mine who lives on Bone Camp has also seen it as well as finding strange tree formations and randomly snapped limbs.
44986,"Report 44986: Memory told of a close up daylight encounter with two, possibly young, Bigfoots near Abbeville",Class A,2014-12-31T12:00:00Z,31.651,-85.19265,2014,Alabama,44986.0,"When my aunt was about 11 or 12 years old, she was helping her older cousin (Jerry) in the field at her aunt's house in an area called ""Screamer"" in Henry County, Alabama.  It was a hot day, and after some time Jerry grew very thirsty and asked my aunt to walk up the road to the house and get him a glass of water.  My aunt then walked through the field back toward the dirt road leading to her aunt's house.  Upon reaching the dirt road, she saw two creatures standing on the other side of the road.  She stopped and began slowly backing up, then stopped again.  She stood there looking at them, and they looking at her, for a minute or so, long enough for her to get a good look at them.  They were only around 10 feet away from her at that point - she on one side of the dirt road and they on the other.  She described them as standing next to each other.  One was, in her estimation, around 5 feet tall and the other was slightly shorter, around 4 feet tall.  She said that she got the impression that they were young.  She said that they were ""real hairy"" and completely covered in dark brownish black hair, that they looked sort of like gorillas but with human looking faces with hair on them, human looking hands, and human looking feet.  She said their noses were free of hair and that the color of their noses was dark brown or black, as were their feet and hands.  They stood very still other than blinking, just looking at her.  Except for being covered in thick hair, their faces looked human with regular human-looking noses.  After a minute or so, she took off running as fast as she could back up to the house to get the water Jerry had requested.  She did not look back as she ran.  She got the water, and proceeded to walk back toward the field.  The creatures were not there anymore.  She never told anyone about this incident until just a couple of months ago because she was always afraid people would make fun of her."
45296,Report 45296: Motorist observes a Bigfoot chasing a deer at night near Bremen,Class A,2014-06-09T12:00:00Z,34.00806,-86.96416,2014,Alabama,45296.0,"Saw a deer run across the road, right behind it was covered in brownish black hair and was at least 7-8 ft tall huge upper body sorta narrow at the hips I can draw ya a pic of it"
45464,Report 45464: Motorist has a daylight sighting on Hwy. 9 east of Cedar Bluff,Class A,2014-06-17T12:00:00Z,34.14117,-85.22781,2014,Georgia,45464.0,"I was driving home from Cedar Bluff high school on Hwy 9 towards my house. As I was coming down the road I caught a glimpse of something at the edge of the wood line. I put on my brakes to get a better view and that's when I saw what it was. It was about 7 to 8 feet tall. Dark hairy color and was standing on 2 legs. It stood and stared at me a few seconds and then turned and walked back into the woods. It took 2 strides and it was gone. I was freaked out!!!! I knew when I saw it, that it was a sasquatch. I came home and told my husband what I had saw and he could clearly tell that I was shaken up."
46746,Report 46746: Nighttime sighting by a motorist west of Newville,Class A,2014-09-17T12:00:00Z,31.23374,-85.21574,2014,Alabama,46746.0,My wife and me and our two children were coming home from my aunts house between 3 and 4 am. It was very foggy. We were within a couple miles from home when she spotted what she said was a very broad creature that stood on two legs and I became really excited when she said what stuck out to her the most was the figures cone shaped head and the way the hair shined when the lights hit it. I am still angry with myself because I was asleep on the passenger seat. She says the creature had its back to the road and disappeared when we went past it. She franticly explained to me what she saw when we got home and being the Bigfoot enthusiast I am jumped in my car and returned to the spot but didn't see anything.
50178,Report 50178: Recollection of a roadside sighting of a white Bigfoot near Blount Springs,Class A,2014-01-14T12:00:00Z,33.89833,-86.84557,2014,Alabama,50178.0,"I was driving a VW bus so I had a good view of my surroundings. As I rounded the first corner of the exit I noticed what I thought was a big white dog, like an Afghan running on all fours toward the road, up an embankment. We both reached the same point at the same time and I thought I would hit the dog. It seemed it didn't notice my car until it reached the side of the road when it was only feet away from the car. I don't remember slowing much but I wasn't going very fast to start with as the curve was pretty tight. As the creature reached the road and I saw it, it stood up on it's back legs. It was covered with long white hair maybe 8 inches long, it wasn't thick but more stringy and dirty looking and it had a round head, not a dog.  I passed the creature and didn't catch it in my mirrors as it was dark. It scared me.I didn't get much detail of it's face but I did notice a fairly large mouth or lips which were prominent. The head was not huge and the body was pretty slender, it was probably as tall as the VW when it stood up, over 6 feet."
65679,Report 65679: Afternoon sighting of a bigfoot by motorist on Hwy 17 just north of Deer Park,Class A,2020-04-16T12:00:00Z,31.24305,-88.31126,2020,Alabama,65679.0,I was driving home from work in the afternoon and completely preoccupied with thoughts of my struggles. When my eyes caught something. However my mind was still not focused other than I was waiting for movement of sorts. It’s second nature to keep a eye out for deer in this area. When I finally noticed that I was looking at  something unusual.  I saw a tall hairy animal walking off into the woods (on two feet) from the road. It had long blonde to light brown hair all over. I never saw the face. I kept my eyes focused on the woods where it walked into. When I reached that spot I was completely shocked at the size that creature was. It had to be at least 9 - 10 feet tall. The only thing I could think of was Bigfoot. Note: I have never been a believer of Bigfoot before but what I saw that day is something I can’t stop thinking about.
67423,Report 67423: Sighting of a Sasquatch crossing forest road off I-20 near AL/GA state border.,Class A,2020-06-15T12:00:00Z,33.64341,-85.41961,2020,Alabama,67423.0,"Me and my wife and two girls were going to see my parents who live in Cleburne county AL and my daughter who had not long gotten her drivers license was driving and I was up front in the passenger seat and my wife and other daughter was in the back. We had just gotten of the interstate and had turned down the long back road that takes us to my parents . And as we came over a hill and something huge and black darted across the road on two feet and into the woods about 50 yards ahead . My daughter said what was that I was like I have no idea , it was massive and very wide across the shoulders and it’s head seemed to just sit on top of its huge shoulders, like this thing was taller and wider than anything I’ve ever seen and moved with unreal speed . My daughter didn’t really get a good of look at it she just seen something big zip across the road , but I seen it long enough to see it was standing up on two feet and really big and I guess what stands out to me the most is just how wide it’s upper body was  big enough to know that no other animal could even come close especially around here, and it’s height I’m just guessing but it seemed easily 8 feet  . I still can’t believe that something like this actually exist I mean how can something that big not be seen more ,you hear the stories but to see something like this that you can’t explain, and you know most people will not believe you but I guess now I’m a believer"
75577,"Report 75577: Daylight sighting, 2 witnesses, outside Heflin 10 miles from GA border off I-20",Class A,2023-02-09T12:00:00Z,33.65175,-85.52335,2023,Alabama,75577.0,My husband and I heard strange sounds for 2 nights in February 2023 and laughed about how they sounded like the Bigfoot sounds on television shows. The 3rd night at dusk we were on our carport looking into the woods that border our property in Heflin (Cleburne County) Alabama. We saw what looked like Bigfoot peeking around a tree at us. We watched it for approximately 5 minutes as it appeared to look at us from the left then the right [of the tree trunk]. I dismissed it as being a distortion with the trees and wind. I turned to go into the house and looked back and distinctly saw what could only be Bigfoot running away. I yelled for my husband and he also saw it running away. It had our hearts beating wildly and the hair standing up on our arms. There was no mistaking what we saw!
50541,Report 50541: Motorist has a close sighting at dusk on AR-258 outside Bald Knob,Class A,2015-12-28T12:00:00Z,35.34737,-91.60007,2015,Arkansas,50541.0,"Around 5pm I was driving down hwy 258 to go to the store. We have had some recent flooding so I was driving slower than normal and watching for deer. Along the way I seen 2 different area of deer, one had 3 I could see the other there was at least 6. So on the way back from the store I knew to slow down in those areas just in case. In one area it is a rather sharp curve and I had seen the most deer there. As I came up on the curve I slowed down and suddenly something jumped out in front of the car!!! I'll call it a ""he from here out.""  He seem to have been running from the pine tree line and took a, what I would call a leap, out onto the road then he was gone. It was only 1 maybe two steps on the road it's self to clear it! I had slammed on the brakes and just sit there in awe wondering if I really seen what I had.  He was standing on two legs, lots of fur and what I would assume Is at least 8 foot tall. When he jumped in front of the car he was about a car length in front of me. He looked to have had a large fish in his hand. I know how that sounds but I swear it was a long fish. My husband said it may have been a stick but I'm a country girl and I know my fish! His ""fur"" was longer than what bear fur would be and although he was dark brown it had a reddish hue to it, the headlights gave s good look at the color as it leaped across.  There is a lake back behind where he was running from but he also jumped across to the right where those 6 plus deer were standing. We are going back at first light to see if he left foot prints. It's so muddy I'm hoping to see some.  We hear sounds out here almost nightly of what we describe as big foot sounds but I've honestly never thought they was out here. It is just sounds you can't describe, so we call it bigfoot sounds. I've had several friends and family hear them and one of them will not stay outside long out here because she's heard it so much. When I got home my husband came to the door to help bring stuff in and ask what was wrong, I said the deer are out bad and he asked if I hit one, I said no and he asked why was I shaking. I didn't realize my whole body was still shaking! LoL  I started telling him and I had tears rolling down, heart pounding and still shaking so bad. It really shook me up so much.  Not sure what else to say. It was one of the most amazing yet scariest things I've ever seen. I know I will not sleep tonight due to thinking about it and what exactly happened."
55410,"Report 55410: Deer hunter encounters several Bigfoots, possibly a family unit, near Searcy",Class A,2015-11-26T12:00:00Z,35.255,-91.50301,2015,Arkansas,55410.0,Hi BFRO my sighting happen nine months ago near Searcy Arkansas I was hunting on Thanksgiving day. It was getting dark when I had a rock thrown over my head which freaked me out so I quickly turned around and lifted my shotgun and light and look up and down the tree line until I came up on a big oak and I saw what looked like a Sasquatch looking at me from behind the oak and it yelled at me with a low grunt and high pitch scream so I jumped and actually took a shot and hit the tree and it took off running back down the line towards a valley.
56108,Report 56108: Sighting at dusk by a Retired Police Officer with Anthropology Degree,Class A,2016-12-02T12:00:00Z,34.4125,-94.1125,2016,Arkansas,56108.0,"While south bound on US71, 8 miles north of the Ouachita River, observed a very tall, dark-colored, upright, bipedal creature crossing the highway and disappearing into the forest."
56735,Report 56735: Motorist has daytime sighting while driving past Joseph T. Robinson military base,Class A,2017-02-10T12:00:00Z,34.85324,-92.25454,2017,Arkansas,56735.0,"I was driving south on Batesville-Pike Rd on my way to work.  There are woods on both sides of this road with a tall chain link fence surrounding the woods on both sides.  The right hand side of the road is part of Camp Robinson.  Just past the fence there is a fire break before the tree line begins.  I had just driven around a sharp curve and due to the curve I was driving pretty slow.  There are lots of deer in this area and I am typically looking to see if any are close by.  There is a small creek bed in the curve with a large culvert running under the road connecting both sides of the street in that area.  Just past the curve I saw a tall, upright, black figure.  It was about 10 yards past the beginning of the treeline.  This creature was walking at an angle through the woods towards the creek.  I saw his right profile and the back of him. It appeared to have arms which were hanging at his side. There are lots of trees in this area so parts of his profile were blocked at times.  All of the leaves are off the trees at this so I had a pretty clear view.  He appeared to be 6-7 feet tall with black hair.  I'm not exactly sure what I saw but I know that it wasn't a deer.  This road has a pretty high amount of traffic in the morning and is highly guarded by Camp Robinson."
62625,Report 62625: Daylight sighting by two hikers at trailhead for Hideout Hollow in Buffalo National River.,Class A,2018-07-22T12:00:00Z,36.042,-93.1545,2018,Arkansas,62625.0,"My son's father and I came over from Oklahoma to the Buffalo National River area. I picked a waterfall out of my waterfall guide book that we were going to go find. We chose Hideout Hollow. When we pulled up to the parking area at the trailhead he turned off the car. Our windows were down because we were both smoking a cigarette. At that time I heard what sounded like if you were in the bathroom and heard your dog sniffing under the door.  I asked him in a whisper “Did you hear that?”  He said “That sounded like heavy machinery off in the distance.”  I let it go because I was just grateful he acknowledged the sound. We started to head down the trail when I realized we left our hiking sticks in the car, so I ran to get them myself. I had a slightly creeped out feeling but didn’t worry about it too much because I could still see him the whole time. Once I got back to him we started down the trail. We were just starting to round the corner that goes to the left when we heard a rustling in the trees to our left. We both stopped started and looked. We saw a huge figure running through the trees. I thought it was a man at first until I realized it was totally covered in hair, medium chocolate brown in color. I remember seeing it’s arms in front of it as if it was moving branches away to protect its face and its hands were black. I whispered “what was that?” He whispered back “I have no idea” I whispered “do you wanna go back?” And he nodded his head yes quickly. The direction it was going, it would’ve crossed the trail just around the curve. We turned around and started walking quickly back towards the car, both of us constantly looking over our shoulder behind us. I started asking questions to make sure we saw the same thing and neither of us forgot. We agreed it was on its hind legs, it was brown, it was a lot bigger than us and it was fast. Suddenly something flew fast over our heads (a rock?) hitting leaves and branches. I turned at looked at my son's dad with a “what the heck?” look on my face and his eyes were huge. We ran the rest of the way to the car. I had never been so scared and I wasn’t sure we would make it back to the car. We did and immediately he began second guessing what we had just seen, suggesting maybe it was a bear, a deer, an elk, etc. I asked him if he’s ever seen a bear run like that on it’s hind legs, or a deer or elk that dark running that smooth, he said no. We went to the Tea Kettle falls area but I was too scared and anxious to get out of the car again, convinced whatever it was could have easily covered ground by then. A Google search once we had service said only black bears live in Arkansas and I’m positive what we saw was brown. I didn’t notice any smells but since we were talking I also didn’t notice if it was quiet or if any birds or bugs were chirping. I know I have no desire to return to the area, I get sick to my stomach any time I think about it."
47536,Report 47536: Evening sighting from a fishing boat on Fools Hollow Lake near Show Low.,Class A,2014-04-22T12:00:00Z,34.285,-110.11,2014,Arizona,47536.0,"On approximately April 22,14 I was at Fools Hollow Lake near Showlow, AZ I was out on the lake around the bend fishing where a storm was starting to roll in from the east as the storm was getting closer I was becoming more uncomfortable so I decided to start heading in. I was heading west when I spotted what I thought was a bear down on all four drinking water from the edge of the lake my approximate coordinates were 34.277763, -110.071018 and when I first spotted the creature its coordinates were 34.277126, -110.072090 off the point at the bend of the lake (the lake is a sideways ""L"" shape. As I got closer to the creature still thinking it was a large black bear I saw it stand up on its two hind legs and look towards me. The creature then turned and walked into the wooded area behind it where I lost sight of it. The small time frame in which I did see the creature walking depicted very similarly to the Patterson video this creature about 7-8' tall longer arm length reaching towards its mid thigh and walking with a very long stride and a hunch. The creature appeared to have a reddish brown color to it a few shades darker than an orangutan. After losing sight of the creature I was unable to catch it in my sight again. With the storm right behind me and lightning all around I did not want to be on the lake in a 12' aluminum boat so I headed back to shore."
69323,Report 69323: 20 miles east of Petrified Forest National Park -- motorhome driver and wife report daylight sighting from Interstate 40,Class A,2021-06-10T12:00:00Z,35.175,-109.25,2021,Arizona,69323.0,"Heading west on I-40 today at 0930 my wife and I saw a Bigfoot 100-150 yards from the hwy heading north. It was not running, but walking. It never looked at the hwy. It must have been 7-8 ft tall. It was thick, as in well built !  There was a rock outcropping behind it which made it very visible. There had to be other travelers who saw this also. We got a long look at it.  15-20 seconds. It was west of Houck AZ. GPS 35.179152, -109.465490 In Apache County, Arizona We were traveling in a 30 ft motorhome so I couldn’t stop. There was other cars behind me. A red motor coach towing a car. With a woman driving. I’d like to add that it was like seeing any other type of natural wildlife on the side of the hwy. They are real and I’m a believer now. It’s hard to explain it to even family. I’m 62 years old and have nothing to gain by reporting this, except the fact that they should be documented and protected at all cost. They are truly one of Gods creations."
46330,Report 46330: Daylight sighting by fisherman at Silverwood Lake near Hesperia,Class A,2014-08-20T12:00:00Z,34.28665,-117.3395,2014,California,46330.0,"Me and my family decided to go fishing at Silverwood lake and we got there around 1:30pm......i was fishing by the lake  and after a while of not catching anything i decided to put a 2nd rod about 100ft away from the 1st one..i went back to my 1st and around 3-4pm i decided to check on the 2nd rod and my 3&4 yr old daughters were following me so i sent them back with my wife.i thought they had gone back so i kept on walking towards the 2nd rod all of a sudden i heard leaves crunching to my left about 30 ft away from me i saw an ape like hairy looking creature with light brown hair....it had long arms that were swinging while it ran...it was also crouching a little to the front stood there in shock frozen for a while and realized my 4 year old daughter was behind me running back to my wife yelling ""MOM!MOM! There's a big animal!""then i went back to mu wife and told her what i saw....What amazed me was the speed it was running......"
48429,Report 48429: Travelers have a nighttime sighting of two hairy bipeds on Hwy. 180 near Grant Grove,Class A,2015-05-16T12:00:00Z,36.77763,-118.9604,2015,California,48429.0,"My wife and I were driving at about 9:30 p.m. Between Grant Grove and Cherry Gap on highway 180, when we came around a corner and our headlights lit up the straight away and next corner about 100 yards away and at the next corner we saw a large hairy figure walking upright as it stepped onto the road at an angle towards us and it took large strides and crossed the road and went down the embankment. It was very tall with dark hair. I have other observations about the sighting but I was afraid I couldn't get it all done in the aloted time."
